{
  "schema": "sourcefold.location.v0",
  "id": "coc:location:innsmouth-601-kvartirant",
  "kind": "location",
  "name": {
    "ru": "Квартирант",
    "en": null
  },
  "location_type": "здание",
  "part_of": "coc:location:innsmouth-yuzhnyy-zhiloy-rayon",
  "number": "601",
  "address": "Бэбсон-стрит, 510",
  "keeper_hint": "Эрвин и Милли Паджетт, обычная пара; квартирант-гибрид библиофил Кермит Аллен Роуз",
  "description": {
    "ru": "Простой двухэтажный дом начала XIX века. Хозяева — незапятнанная пара под пятьдесят, Эрвин и Милли Паджетт: он — плотник в очках, берущийся за любую работу в городе, она почти всё время возится в большом огороде за домом. Чтобы свести концы с концами, они сдают подвал местному жителю Кермиту Аллену Роузу, не подозревая, что их жилец — хитрый гибрид, едва ли заслуживающий называться человеком. В подвале Роуз устроил библиотеку: книги занимают больше половины комнаты, остальное — узкая кровать. Среди его оккультных томов — первое издание «Чудес тауматургии в Новой Английской Ханаане» Уорда, уникальная рукописная копия «О монстрах и их естестве» и длинная брошюра «Элтдаунские письмена».",
    "en": null
  },
  "residents": [
    {
      "id": "pobeg-iz-innsmuta-ru/character/ervin-padzhett",
      "note": "хозяин дома"
    },
    {
      "id": "pobeg-iz-innsmuta-ru/character/milli-padzhett",
      "note": "хозяйка дома"
    },
    {
      "id": "pobeg-iz-innsmuta-ru/character/kermit-allen-rouz",
      "note": "квартирант, снимает подвал"
    }
  ],
  "refs": [
    "coc:creature:deep-one-hybrid",
    "coc:tome:thaumaturgical-prodigies-in-the-new-england-canaan",
    "coc:tome:monstres-and-their-kynde",
    "coc:tome:eltdown-shards"
  ],
  "axes": {
    "era": [
      "1920s"
    ],
    "ruleset": "core"
  },
  "sources": [
    {
      "book_id": "pobeg-iz-innsmuta-ru",
      "physical_page": 42,
      "printed_page": 42,
      "method": "book_text",
      "verified": true
    },
    {
      "book_id": "pobeg-iz-innsmuta-ru",
      "physical_page": 20,
      "printed_page": 20,
      "method": "book_text",
      "verified": true,
      "note": "Указатель книги."
    }
  ],
  "quality": {
    "needs_review": false,
    "flags": [],
    "notes": null
  }
}
