{
  "schema": "sourcefold.location.v0",
  "id": "coc:location:innsmouth-503-pozharnaya-chast",
  "kind": "location",
  "name": {
    "ru": "Пожарная часть",
    "en": null
  },
  "location_type": "здание",
  "part_of": "coc:location:innsmouth-pribrezhnaya-promyshlennaya-zona-i-torgovye-rayony",
  "number": "503",
  "address": "Пейн-стрит, 100",
  "keeper_hint": "Замкнутые незапятнанные пожарные",
  "description": {
    "ru": "Небольшое обветшалое пожарное депо с двумя старинными пожарными машинами, из которых на ходу только одна. В штате четверо пожарных, при необходимости собирают большую группу добровольцев. Начальник — 53-летний Артур Стоуз, неопрятный и неразговорчивый. Все пожарные и почти все добровольцы — обычные люди: гибриды мало интересуются гражданскими обязанностями. Пожарные опасаются чужаков и отказываются отвечать на расспросы; упоминание пропавшего Зэдока Аллена, который часто заглядывал в депо, вызывает у них явный страх.",
    "en": null
  },
  "residents": [
    {
      "id": "pobeg-iz-innsmuta-ru/character/artur-stouz",
      "note": "начальник пожарной охраны"
    },
    {
      "id": "pobeg-iz-innsmuta-ru/character/zedok-allen",
      "note": "часто заглядывал в депо"
    }
  ],
  "axes": {
    "era": [
      "1920s"
    ],
    "ruleset": "core"
  },
  "sources": [
    {
      "book_id": "pobeg-iz-innsmuta-ru",
      "physical_page": 40,
      "printed_page": 40,
      "method": "book_text",
      "verified": true
    }
  ]
}
