{
  "schema": "sourcefold.location.v0",
  "id": "coc:location:innsmouth-1006-nik-kasper",
  "kind": "location",
  "name": {
    "ru": "Хижина Ника Каспера",
    "en": null
  },
  "location_type": "здание",
  "part_of": "coc:location:innsmouth-okrainy",
  "number": "1006",
  "address": null,
  "keeper_hint": "человек леса",
  "description": {
    "ru": "Длинная узкая хижина, под карнизами развешаны звериные капканы всех мастей, столбы забора увенчаны выбеленными солнцем черепами — в основном енотов и оленей. Внутри просторно, хранятся богатые запасы сушёного мяса, овощей и другой провизии; вся мебель сделана вручную. Здесь живёт охотник и зверолов Ник Каспер.",
    "en": null
  },
  "residents": [
    {
      "id": "pobeg-iz-innsmuta-ru/character/nik-kasper",
      "note": "хозяин хижины"
    }
  ],
  "axes": {
    "era": [
      "1920s"
    ],
    "ruleset": "core"
  },
  "sources": [
    {
      "book_id": "pobeg-iz-innsmuta-ru",
      "physical_page": 55,
      "printed_page": 55,
      "method": "book_text",
      "verified": true,
      "note": "Стр. 55–56."
    },
    {
      "book_id": "pobeg-iz-innsmuta-ru",
      "physical_page": 21,
      "printed_page": 21,
      "method": "book_text",
      "verified": true,
      "note": "Указатель книги."
    }
  ],
  "quality": {
    "needs_review": false,
    "flags": [],
    "notes": null
  }
}
