{
  "schema": "sourcefold.location.v0",
  "id": "coc:location:innsmouth-607-deniel-mauri",
  "kind": "location",
  "name": {
    "ru": "Дом Даниэла Моури",
    "en": null
  },
  "location_type": "здание",
  "part_of": "coc:location:innsmouth-yuzhnyy-zhiloy-rayon",
  "number": "607",
  "address": "Гэррисон-стрит, 901",
  "keeper_hint": "незапятнанный работник рыбопереработки; жена работает в Бакалейном магазине",
  "description": {
    "ru": "Скромный георгианский дом бездетной незапятнанной пары под пятьдесят — Даниэла и Сандры Моури. Даниэл взвешивает и таскает улов в рыбоупаковочной компании Уэйта, Сандра подрабатывает в бакалейном магазине в центре (702). Если с ними подружиться, они расскажут кое-какие секреты Иннсмута.",
    "en": null
  },
  "residents": [
    {
      "id": "pobeg-iz-innsmuta-ru/character/daniel-mouri",
      "note": "хозяин дома"
    },
    {
      "id": "pobeg-iz-innsmuta-ru/character/sandra-mouri",
      "note": "жена"
    }
  ],
  "refs": [
    "coc:location:innsmouth-702-bakaleynyy-magazin",
    "coc:location:innsmouth-507-rybopererabatyvayushchie-predpriyatiya"
  ],
  "axes": {
    "era": [
      "1920s"
    ],
    "ruleset": "core"
  },
  "sources": [
    {
      "book_id": "pobeg-iz-innsmuta-ru",
      "physical_page": 44,
      "printed_page": 44,
      "method": "book_text",
      "verified": true
    },
    {
      "book_id": "pobeg-iz-innsmuta-ru",
      "physical_page": 20,
      "printed_page": 20,
      "method": "book_text",
      "verified": true,
      "note": "Указатель книги («Дэниел Маури»)."
    }
  ],
  "quality": {
    "needs_review": false,
    "flags": [],
    "notes": "Имя в заголовке раздела книги — «Даниэл Моури», в указателе книги и путеводителе — «Дэниел Маури»; взято написание раздела."
  }
}
