{
  "schema": "sourcefold.location.v0",
  "id": "coc:location:innsmouth-402-semya-kventina-everilla",
  "kind": "location",
  "name": {
    "ru": "Дом Квентина Эверилла",
    "en": null
  },
  "aliases": [
    "Семья Квентина Эверилла"
  ],
  "location_type": "здание",
  "part_of": "coc:location:innsmouth-severnyy-zhiloy-rayon",
  "number": "402",
  "address": "Пирс-стрит, 903",
  "keeper_hint": "Плотник Квентин, сын Джозеф — водитель грузовика — и его семья; ищут магической мести Ралсе Маршу, обесчестившему дочь Квентина; зачарованная флейта",
  "description": {
    "ru": "Величественный федеральный особняк, недавно покрашенный, с ухоженным двором и садами — гораздо лучше большинства домов Иннсмута. Здесь живут Квентин Эверилл, его сын Джозеф (39), невестка Лора (35) и их четырёхлетняя дочь Джун. Незамужняя дочь Квентина, Патриция, жила здесь же, пока несколько недель назад не покончила с собой после того, как её изнасиловал Ралса Марш.\n\nКвентин поклялся отомстить и предупредил Барнабаса Марша, что пошлёт за Ралсой «демонического защитника Эвериллов», — Барнабас, как ни странно, согласился, лишь известив Ралсу и доктора Роули Марша. Джозеф и Лора боятся за дочь, но старик горд и упрям: он изучает старый семейный журнал и скоро проведёт ритуал. Резная деревянная флейта, подаренная бирманским колдуном, зачарована и даёт +20% к шансу заклинания; с ней Квентин призовёт и скует Служителя Внешних богов, чтобы убить Ралсу. Прочитавший семейный журнал Эвериллов получает +2% Мифов Ктулху и теряет 1d3 Рассудка; в журнале — заклинание Summon/Bind Servitor of the Outer Gods.\n\nВ остальном Эвериллы не вмешиваются в дела города: Джозеф водит грузовик в рыбоупаковочной компании Биллингема, Квентин работает плотником; о тёмной тени над Иннсмутом они говорить не любят.",
    "en": null
  },
  "history": {
    "ru": "Дед Квентина, капитан Гарднер Эверилл, торговал на Дальнем Востоке и узнал от мудрого бирманского старца опасный ритуал призыва могущественного духа-служителя. В 1840-х (по хронике — в 1842 году) его сына Дугласа убил последователь Обеда, которого освободили благодаря вмешательству Марша. Гарднер и его выживший сын — отец Квентина — в канун летнего солнцестояния с помощью флейты призвали и сковали Служителя Внешних богов и велели ему убить убийцу; тот исполнил приказ с явным удовольствием. С тех пор Марши старались не злить Эвериллов — пока Ралса не надругался над Патрицией.",
    "en": null
  },
  "residents": [
    {
      "id": "pobeg-iz-innsmuta-ru/character/kventin-everill",
      "note": "глава семьи"
    },
    {
      "id": "pobeg-iz-innsmuta-ru/character/dzhozef-everill",
      "note": "сын Квентина, с женой и дочерью"
    }
  ],
  "refs": [
    "pobeg-iz-innsmuta-ru/character/ralsa-marsh",
    "coc:creature:servitor-of-outer-gods",
    "coc:spell:summon-bind-servitor-of-the-outer-gods"
  ],
  "axes": {
    "era": [
      "1920s"
    ],
    "ruleset": "core"
  },
  "sources": [
    {
      "book_id": "pobeg-iz-innsmuta-ru",
      "physical_page": 35,
      "printed_page": 35,
      "method": "book_text",
      "verified": true
    },
    {
      "book_id": "pobeg-iz-innsmuta-ru",
      "physical_page": 36,
      "printed_page": 36,
      "method": "book_text",
      "verified": true
    },
    {
      "book_id": "pobeg-iz-innsmuta-ru",
      "physical_page": 8,
      "printed_page": 8,
      "method": "book_text",
      "verified": true,
      "note": "Хроника «История Иннсмута», 1842 год"
    }
  ]
}
