{
  "schema": "sourcefold.location.v0",
  "id": "coc:location:innsmouth-901-starye-prichaly",
  "kind": "location",
  "name": {
    "ru": "Старые причалы",
    "en": null
  },
  "location_type": "место",
  "part_of": "coc:location:innsmouth-gavan",
  "number": "901",
  "address": null,
  "keeper_hint": "гниют, почти заброшены; несколько небольших лодок, принадлежащих гибридам",
  "description": {
    "ru": "Отмеченные на карте причалы — немногие, ещё пригодные для использования; остальные, особенно к югу от Мануксета, давно обрушились в воду. Там, где швартовались гордые корабли, теперь стоят лишь небольшие рыбацкие лодки гибридов. Когда-то причалы носили имена владельцев, но теперь их почти никто не помнит.",
    "en": null
  },
  "refs": [
    "coc:creature:deep-one-hybrid"
  ],
  "axes": {
    "era": [
      "1920s"
    ],
    "ruleset": "core"
  },
  "sources": [
    {
      "book_id": "pobeg-iz-innsmuta-ru",
      "physical_page": 52,
      "printed_page": 52,
      "method": "book_text",
      "verified": true
    },
    {
      "book_id": "pobeg-iz-innsmuta-ru",
      "physical_page": 21,
      "printed_page": 21,
      "method": "book_text",
      "verified": true,
      "note": "Указатель книги."
    }
  ],
  "quality": {
    "needs_review": false,
    "flags": [],
    "notes": null
  }
}
